theme,citation
"Amour véritable et sincère","Hélas ! monsieur le docteur, je vous aimerai comme je pourrai.;J'ai souvent souffert, je me suis trompé quelquefois ; mais j'ai aimé. C'est moi qui ai vécu, et non pas un être factice créé par mon orgueil et mon ennui.;Je t'aime, Camille, voila tout ce que je sais.;Suis-je donc amoureux"
"Idéal amoureux et désillusion","Je veux aimer, mais je ne veux pas souffrir ; je veux aimer d'un amour éternel, et faire des serments qui ne se violent pas. Voila mon amant.;Ton amour m'eut donné la vie;mais ton amitié m'en consolera"
"Orgueil et fierté","Orgueil ! Le plus fatal des conseillers humains, qu'es-tu venu faire entre cette fille et moi?;qu'es-tu venu faire sur nos lèvres, orgueil, lorsque nos mains allaient se joindre ?"
"Stratégies de séduction et manipulation","faire la cour a Rosette devant Camille elle-même;Non, non, Camille, je ne t'aime pas ; je ne suis pas au désespoir. Je n'ai pas le poignard dans le cœur et je te le prouverai.;Oui, tu sauras que j'en aime une autre avant que de partir d'ici.;Je ne vous aime pas, moi : je n'ai pas été cherché par dépit cette malheureuse enfant au fond de sa chaumière, pour en faire un appât, un jouet."
"Critique des conventions religieuses","ces récits hideux qui t'ont empoisonnée;Sais-tu ce que c'est que des nonnes, malheureuse fille? Elles qui te représentent l'amour des hommes comme un mensonge?"
"Rapport au temps et à l'âge","Je n'en ai nulle envie;Non, pas ce soir;Je ne suis pas assez jeune [...] ni assez vieille pour aimer le passé"
"Gestes et physique de l'amour","Des mots sont des mots, et des baisers sont des baisers.;Touche-les et soyons bon amis.;Je n'aime pas les attouchements."
"Tragédie et innocence","nous sommes deux enfants insensés, et nous avons joué avec la vie et la mort ; mais notre cœur est pur ; ne tuez pas Rosette, Dieu juste !"